Text ,Slang,Abbreviations,Text meaning
yêu thương các anh tài nhiều lắm các anh đã mang lại một mùa hè tuyệt vời,,,yêu thương các anh tài nhiều lắm các anh đã mang lại một mùa hè tuyệt vời
yêu lắm cảm ơn soobin và các anh tài đã tạo nên một mùa hè tuyệt vời,,,yêu lắm cảm ơn soobin và các anh tài đã tạo nên một mùa hè tuyệt vời
ước gì tặng được sibun hộp nama em làm,,,ước gì tặng được sibun hộp nama em làm
quá tuyệt vời một chương trình nó hay nó giá trị về nhân văn các ca sĩ nghệ sĩ cháy hết mình vì ng hâm mộ 46t như tôi lần đầu thấy khán giả yêu ca nhạc mang tầm quốc tế,,46t ng,quá tuyệt vời một chương trình nó hay nó giá trị về nhân văn các ca sĩ nghệ sĩ cháy hết mình vì người hâm mộ 46 tuổi như tôi lần đầu thấy khán giả yêu ca nhạc mang tầm quốc tế
tự hào về anh ạ,,,tự hào về anh ạ
tự hào về anh về kingdom,,,tự hào về anh về kingdom
cảm ơn mng vì đã đến cảm ơn em đã giữ vững nhiệt huyết và sẽ có rất nhiều sân khấu với hàng chục nghìn người hướng mắt về em chỉ cần nhìn đôi mắt em long lanh vì hạnh phúc ấy kingdom sẽ nguyện sĩ suốt đời,,,cảm ơn mng vì đã đến cảm ơn em đã giữ vững nhiệt huyết và sẽ có rất nhiều sân khấu với hàng chục nghìn người hướng mắt về em chỉ cần nhìn đôi mắt em long lanh vì hạnh phúc ấy kingdom sẽ nguyện sĩ suốt đời
yêu a sibun lắm,,a sibun,yêu anh soobin lắm
lần đầu đu trend nì hông với ai khác mà là với mẹ iuuu mãi iu atvncg vì những kỉ niệm đẹp này concertatvncg2024,nì,atvncg iu,lần đầu đu xu hướng này không với ai khác mà là với mẹ yêu mãi yêu anh trai vượt ngàn chông gai vì những kỉ niệm đẹp này concert anh trai vượt ngàn chông gai 2024
mấy bạn ui c trang là bên báo lớn c đặt câu hỏi mở rất hay cho hùng huỳnh đó câu hỏi giúp cho nghệ sỹ có thể đưa ra khẳng định vị thế và điểm tốt của bản thân,,c,mấy bạn ui chị trang là bên báo lớn chị đặt câu hỏi mở rất hay cho hùng huỳnh đó câu hỏi giúp cho nghệ sỹ có thể đưa ra khẳng định vị thế và điểm tốt của bản thân
nói khéo léo là ăn điểm đặc biệt là nghệ sỹ mới có anh chị nhà báo quan tâm hỏi là may mắn mọi người hông nên đi sâu vào việc đặt nhiều câu hỏi 1 lúc hay nghĩ gấu bị làm khó nha,,,nói khéo léo là ăn điểm đặc biệt là nghệ sỹ mới có anh chị nhà báo quan tâm hỏi là may mắn mọi người hông nên đi sâu vào việc đặt nhiều câu hỏi 1 lúc hay nghĩ gấu bị làm khó nha
đó là c ấy đang cho gấu cơ hội dc chia sẻ và c ấy cũng yêu mến gấu á,,c đc,đó là chị ấy đang cho gấu cơ hội được chia sẻ và chị ấy cũng yêu mến gấu á
hông để ai bắt nạt mạng chị ý nha hông tốt cho gấu đâu,hông,,không để ai bắt nạt mạng chị ý nha hông tốt cho gấu đâu
hỉu ý tui hem,hỉu hem,,hiểu ý tôi không
rất cười tôi đã hài sếp thiện ơi rhymastic atvncg2024,,atvncg,rất cười tôi đã hài sếp thiện ơi rhymastic anh trai vượt ngàn chông gai 2024
não cá vàng đăng stt nhưng quên ko gắn hình,não cá vàng,stt ko,hay quên đăng trạng thái nhưng quên không gắn hình
anh ơi hãy đẩy viu cho em chứ anh trai em k cưới vợ muộn được đâu anh ơi anh,viu,k,anh ơi hãy đẩy lượt xem cho em chứ anh trai em không cưới vợ muộn được đâu anh ơi anh
tại anh bận làm con mèo tối qua nên quên hết chứ gì,,,tại anh bận làm con mèo tối qua nên quên hết chứ gì
sao có thể cute dữ vậy sibun ơi,,,sao có thể dễ thương dữ vậy sibun ơi
chồng k cô đơn đâu em cũng não cá vàng có thể quên mọi thứ,não cá vàng,k,chồng không cô đơn đâu em cũng hay quên có thể quên mọi thứ
trống cơm phiên bản nhà trẻ đáng iu vô cùng,,iu,trống cơm phiên bản nhà trẻ đáng yêu vô cùng
thế thì mình gắn đi ạ,,,thế thì mình gắn đi ạ
học bài đi đào ơi,,,học bài đi đào ơi
sibun yên tâm đã có fan gắn hình giùm roài nha,,,sibun yên tâm đã có fan gắn hình giùm rồi nha
kkk em tôi,,,kkk em tôi
khong sao đâu chồng,,,không sao đâu chồng
hơ hơ,,,hơ hơ
sao cu em có ý kiến gì nhỉ,,,sao cu em có ý kiến gì nhỉ
ko sao xốp ạ tôi cũng não cá vàng ko kém xốp,xốp não cá vàng,ko,không sao bạn ạ tôi cũng trí nhớ kém không kém bạn
xốp này dùng trong công trình xây dựng của nhà kế bên,,,xốp này dùng trong công trình xây dựng của nhà kế bên
không anh ơi đó là dấu hiệu của người có tuổi đó ạ,,,không anh ơi đó là dấu hiệu của người có tuổi đó ạ
đó gọi là gì là dấu hiệu của tuổi tác giống chị quên hoài chứ gì,,,đó gọi là gì là dấu hiệu của tuổi tác giống chị quên hoài chứ gì
ngại chết,,,ngại chết
vẫn chưa tìm được nút haha ở threads,,,vẫn chưa tìm được nút haha ở threads
không quên em là được rồi,,,không quên em là được rồi
thồi,thồi,,thôi 
các người đừng bao giờ mong tôi hài lòng vì ba tôi không phải là một long hài tồi,,,các người đừng bao giờ mong tôi hài lòng vì ba tôi không phải là một long hài tồi
đề xuất pam và bill hợp tác mở 1 phòng khám,,,đề xuất pam và bill hợp tác mở 1 phòng khám
anh ơi mình thừa một dấu cách,,,anh ơi mình thừa một dấu cách
đã bảo đừng mong hài lòng rồi,,,đã bảo đừng mong hài lòng rồi
nay cô bé thư giãn chuyển qua làm cô bé bác sĩ rùi ạ,,,nay cô bé thư giãn chuyển qua làm cô bé bác sĩ rùi ạ
nay cô ấy lớn rồi,,,nay cô ấy lớn rồi
cô là điều dưỡng nè pam ơi mong vài chục năm nữa cô cháu mình lm đồng nghiệp,,lm,cô là điều dưỡng nè pam ơi mong vài chục năm nữa cô cháu mình làm đồng nghiệp
đi làm đơ cả người,,,đi làm đơ cả người
nàng ta đáng iu chít mất,chít mất,iu,nàng ta đáng yêu chết mất
bác sĩ đáng iu quó,iu quó,,bác sĩ đáng yêu quá
lớn nhanh quá mới ngày nào còn nói chuyện bập bẹ rồi nay đã làm bác sĩ rồi tgian trôi nhanh thật chẳng mấy mà mình già,,tgian,lớn nhanh quá mới ngày nào còn nói chuyện bập bẹ rồi nay đã làm bác sĩ rồi thời gian trôi nhanh thật chẳng mấy mà mình già
cute qué,,,cute quá
ghéc iiii,,,ghéc iiii
h mới thấy đc ng dth hơn cưng,,dth đc ng h,giờ mới thấy được người dễ thương hơn cưng
hong có trời cưng xinh đẹp nhứt nha má,,,hong có trời cưng xinh đẹp nhứt nha má
tr oii tắt cái tb dùm coi,,tr tb,trời ơi tắt cái thông báo dùm coi
tôi không hài lòng với cáp sần sự thừa dấu cách sắp cần chỉnh sửa,cáp sần,,tôi không hài lòng với tiêu đề sự thừa dấu cách sắp cần chỉnh sửa
bác sĩ chữa bệnh cho tôi với,,,bác sĩ chữa bệnh cho tôi với
đang đi bộ hồ hoàn kiếm hà nội thì gặp mấy anh này đứng ở góc ban công hát karaoke mà được quá trời người đi đường dừng chân hát theo luôn hay quá mọi người ạ ,,,đang đi bộ hồ hoàn kiếm hà nội thì gặp mấy anh này đứng ở góc ban công hát karaoke mà được quá trời người đi đường dừng chân hát theo luôn hay quá mọi người ạ 
iu quó đi,,iu,yêu quá đi
nói chung là đẹp,,,nói chung là đẹp
tôi không có hứng thú với ngưu ma vương hay hồng hài nhi gì cả thứ tôi hứng thú là một công việc lương 50tr được nghỉ full 2 ngày cuối tuần và không bao giờ ot tôi sẽ cầu nguyện,ngưu ma vương hồng hài nhi,ot 50tr,tôi không có hứng thú với người đàn ông lớn tuổi hay thằng con trai nhỏ tuổi gì cả thứ tôi hứng thú là một công việc lương 50 triệu được nghỉ full 2 ngày cuối tuần và không bao giờ làm việc quá thời gian tôi sẽ cầu nguyện
tôi cũng như bạn,,,tôi cũng như bạn
mơ mộng viển vông đột nhiên viral tiểu nữ hoảng loạn mong chư vị huynh đài đừng phán xét nặng nề ước mơ của tiểu nữ ai mà hong có ước mơ đa tạ,tiểu nữ chư vị huynh đài,,mơ mộng viển vông đột nhiên xu hướng người phụ nữ non tơ hoảng loạn mong bạn đừng phán xét nặng nề ước mơ của tiểu nữ ai mà hong có ước mơ đa tạ
xin bệ hạ tha thứ tiểu nữ không cố ý có các chư vị huynh đài ở đây chứng kiến,,,xin bệ hạ tha thứ tiểu nữ không cố ý có các chư vị huynh đài ở đây chứng kiến
tự mở cty mà trả lương cho bản thân thôi chứ có kỹ năng để ng ta trả lương 50m cho bạn mà vẫn phải đứng dưới ng khác thì hơi non,,cty ng 50m,tự mở công ty mà trả lương cho bản thân thôi chứ có kỹ năng để ng ta trả lương 50 triệu cho bạn mà vẫn phải đứng dưới người khác thì hơi non
chia sẻ 1 chút là chồng mình lương xấp xỉ mức đó nhưng mà nhiều hôm vợ con đi ngủ từ 10h tối tới sáng 7h dậy thì ổng vẫn đang ngồi làm chưa ngủ miếng nào,,,chia sẻ 1 chút là chồng mình lương xấp xỉ mức đó nhưng mà nhiều hôm vợ con đi ngủ từ 10 giờ tối tới sáng 7 giờ dậy thì ổng vẫn đang ngồi làm chưa ngủ miếng nào
z nên em mới mơ á sis hic,,z sis,vậy nên em mới mơ á chị hic
50 tr mà ko ot nghe hơi viển vông á ní,,ot ko 50tr,50 triệu mà không làm việc quá thời gian nghe hơi viển vông á bạn
trừ khi em làm mấy vị trí đặc biệt hiếm ai thay thế được thì mới có thể lương 50m ko ot nghỉ full t7 cn chứ chị và người quen đều phải làm trên 10h tuần t7 cn có khi phải bò làm tiếp,,ot t7 cn 50m ko,trừ khi em làm mấy vị trí đặc biệt hiếm ai thay thế được thì mới có thể lương 50 triệu không làm việc quá thời gian nghỉ full thứ 7 chủ nhật chứ chị và người quen đều phải làm trên 10 giờ tuần thứ 7 chủ nhật có khi phải bò làm tiếp
yên bình của chị đắt quóa,,,yên bình của chị đắt quá
cái này có thiệt mà mình có hai thằng bạn i chang như bạn nói đó không viễn vông đâu bạn ráng phấn đấu nha,,,cái này có thiệt mà mình có hai thằng bạn i chang như bạn nói đó không viễn vông đâu bạn ráng phấn đấu nha
bạn bạn làm ngành gì vậy ạ,,,bạn bạn làm ngành gì vậy ạ
lương 50tr khó mà đc bình yên 2 ngày cuối tuần lắm có khi còn phải ot á,,ot 50tr,lương 50 triệu khó mà đc bình yên 2 ngày cuối tuần lắm có khi còn phải làm việc quá thời gian á
yên bình có quá đắt không,,,yên bình có quá đắt không
k biết nữa nhưng lương 50m thì chắc tăng ca full ngày đó,,k 50m,không biết nữa nhưng lương 50 triệu thì chắc tăng ca full ngày đó
nghe mệt quá muốn làm siêu nhân,,,nghe mệt quá muốn làm siêu nhân
vậy là bạn có hứng với thần tài rồi giống kui,,,vậy là bạn có hứng với thần tài rồi giống kui
người đàn ông mà ai cũng hứng thú,,,người đàn ông mà ai cũng hứng thú
nếu điều đó quá khó hãy cho em 1 mức lương ngon tới nỗi em sẵn sàng ot trong hạnh phúc ạ,,ot,nếu điều đó quá khó hãy cho em 1 mức lương ngon tới nỗi em sẵn sàng làm việc quá thời gian trong hạnh phúc ạ
tôi sẵn sàng ot với lương thật cao,,ot,tôi sẵn sàng làm việc quá thời gian với lương thật cao
cầu nguyện là đúng á bạn ko nhà sử dụng lao động nào trả lương đến 50m tháng mà để người lao động được thảnh thơi vậy đâu họ rút tới cái giọt năng lượng cuối cùng của bạn luôn,,ko 50m,cầu nguyện là đúng á bạn không nhà sử dụng lao động nào trả lương đến 50 triệu tháng mà để người lao động được thảnh thơi vậy đâu họ rút tới cái giọt năng lượng cuối cùng của bạn luôn
có ai sắp sinh nhật 0 ạ ước cho em nnay với hiệu nghiệm em nguyện chia cho ng đó nửa tháng lương đầu,,0 nnay ng,có ai sắp sinh nhật không ạ ước cho em nnay với hiệu nghiệm em nguyện chia cho người đó nửa tháng lương đầu
bà chắc chưa tui kh cần sn tui cũng mnf cho bà liền nè,,sn mnf kh,bà chắc chưa tui không cần sinh nhật tui cũng ước cho bà liền nè
liềng luôn sốp ơi,sốp,,liền luôn bạn ơi
từ kinh nghiệm của tui thấy khi đạt đc điều này bác sẽ còn muốn nhiều thứ khác nữa áp lực hơn nữa chứ chưa dừng lại đâu,,dc,từ kinh nghiệm của tui thấy khi đạt được điều này bác sẽ còn muốn nhiều thứ khác nữa áp lực hơn nữa chứ chưa dừng lại đâu
cầu nguyện cho bảnh nữa đi,bảnh,,cầu nguyện cho mình nữa đi
đâu ai đánh thuế giấc mơ đâu,,,đâu ai đánh thuế giấc mơ đâu
2 vấn đề của tôi,,,2 vấn đề của tôi
không chịu ngủ,,,không chịu ngủ
ngủ rồi không chịu dậy,,,ngủ rồi không chịu dậy
nếu có kiếp sau con vẫn muốn làm con của mẹ,,,nếu có kiếp sau con vẫn muốn làm con của mẹ
hai người bố,,,hai người bố
mình biết mình mới được 3 nghìn người trên thread like mình tự hào,,,mình biết mình mới được 3 nghìn người trên thread like mình tự hào
ê nha atvncg,,atvncg,ê nha anh rai vượt ngàn chông gai
nè he chưa nhắc gì ai đừng vào giãy nảy lên t thấy đứa nào nhà bên vô toxic là t tiễn vong hết đó,tiễn vong,t,nè he chưa nhắc gì ai đừng vào giãy nảy lên tao thấy đứa nào nhà bên vô toxic là tao cho ra đảo hết đó
phát ngôn k suy nghĩ coi thường khán giả,,k,phát ngôn không suy nghĩ coi thường khán giả
sao anh này nói câu không có bánh cuốn hơi thiếu tỉnh bơ z nè ảnh diễn hay ảnh không biết vụ kia vậy ạ,,z,sao anh này nói câu không có bánh cuốn hơi thiếu tỉnh bơ vậy nè ảnh diễn hay ảnh không biết vụ kia vậy ạ
cái video này phải viral lên cơ mà tôi thắc mắc ko biết ảnh vô tình hay troll ta tại bình thường ảnh đứng ngoài mấy zụ này mà,,ko zụ,cái video này phải xu hướng lên cơ mà tôi thắc mắc không biết ảnh vô tình hay chơi khăm ta tại bình thường ảnh đứng ngoài mấy vụ này mà
mọi người ơi em có 1 câu hỏi thật sự là em không biết thật nên ai biết có thể giải thích cho em vụ bánh cuốn là sao ạ,,,mọi người ơi em có 1 câu hỏi thật sự là em không biết thật nên ai biết có thể giải thích cho em vụ bánh cuốn là sao ạ
1 phòng xvip là 115 tháng lương của ảnh rồi ý đúng cắn răng cắn cỏ,,,1 phòng xvip là 115 tháng lương của ảnh rồi ý đúng cắn răng cắn cỏ
ê thề khlq nma có nhất thiết bạn phải đăng lên như này r gây war k ạ a độ ghét nhất mấy kiểu này bạn làm như này chỉ khiến lần sau anh độ có chuyện gì sẽ k kể cho kênh chat nữa thoi biết là nó cũng chả có gì nma bạn đăng lên như này đúng là gây war cộng đồng vch và nó xấu vcl bạn ạ đừng nghĩ vậy là hay nhé,vcl vch gây war,k nma khlq r,ê thề không liên quan nhưng mà có nhất thiết bạn phải đăng lên như này rồi gây chiến không ạ a độ ghét nhất mấy kiểu này bạn làm như này chỉ khiến lần sau anh độ có chuyện gì sẽ không kể cho kênh chat nữa thoi biết là nó cũng chả có gì nhưng mà bạn đăng lên như này đúng là gây chiến cộng đồng quá  và nó xấu khiếp bạn ạ đừng nghĩ vậy là hay nhé
ê ảnh thích ăn bánh cuốn cao bằng mẹ lý thôi nên ko có ảnh buồn á,,ko,ê anh thích ăn bánh cuốn cao bằng mẹ lý thôi nên không có anh buồn á
cơ mà bọn nhái cũng hài thay vì chúng nó thất vọng chính cái tệ của bên chúng nó thì nó lại thất vọng ông độ vì đã nói đúng đúng nhái,,,cơ mà bọn nhái cũng hài thay vì chúng nó thất vọng chính cái tệ của bên chúng nó thì nó lại thất vọng ông độ vì đã nói đúng đúng nhái
đừng có lôi ông độ vào ổng luôn nói rằng bản thân khó chịu vì thường xuyên bị nhắc tên trong những câu chuyện không liên quan ổng nhắc bánh cuốn vì mẹ lý thường có thói quen làm bánh cuốn cho ổng ăn món đó gắn liền với ổng từ lâu rồi lôi cho lắm vào đến lúc bị chỉ mặt thẳng tên trên group thì lo mà nghe chửi,,,đừng có lôi ông độ vào ổng luôn nói rằng bản thân khó chịu vì thường xuyên bị nhắc tên trong những câu chuyện không liên quan ổng nhắc bánh cuốn vì mẹ lý thường có thói quen làm bánh cuốn cho ổng ăn món đó gắn liền với ổng từ lâu rồi lôi cho lắm vào đến lúc bị chỉ mặt thẳng tên trên group thì lo mà nghe chửi
manifest anh độ tham gia mùa 2,,,manifest anh độ tham gia mùa 2
khoan sao anh này bảo lương 7 chiệu tiền đâu mua xvip 80 chiệu,chiệu,,khoan sao anh này bảo lương 7 chiệu tiền đâu mua xvip 80 triệu
ko có cả pickle ball cơ,,ko,không có cả pickle ball cơ
ê nha,,,ê nha
tụi em nhắc anh,,,tụi em nhắc anh
thồi nha,thồi,,thôi nha
vụ bánh cuốn là vụ gì vậy mng,,mng,vụ bánh cuốn là vụ gì vậy mọi người
phòng 20tr nhà bên,,20tr,phòng 20 triệu nhà bên
ê,,,ê
ê đặc sản hn đó,,hn,ê đặc sản hà nội đó
phải là bánh cuốn,,,phải là bánh cuốn
người cao bằng nhất định phải bánh cuốn,,,người cao bằng nhất định phải bánh cuốn
ê bọn m đừng mang anh t lên đây nhiều được k ý là cứ sao sao á đừng có nhét chữ vào mồm anh tao nữa đừng có vẽ nữa bây ơi có đứa k biết lại vào mắng anh tao,,m t k ,ê bọn mày đừng mang anh tao lên đây nhiều được không ý là cứ sao sao á đừng có nhét chữ vào mồm anh tao nữa đừng có vẽ nữa bây ơi có đứa không biết lại vào mắng anh tao
lọc được quả suộc buồn cười quá,quả suộc,,lọc được quả nguồn buồn cười quá
có bạn gai con này phát quà cho bất cứ ai đọc đúng slogan của kim chủ tcb cute v,gai con kim chủ,tcb,có bạn hâm mộ chông gai này phát quà cho bất cứ ai đọc đúng slogan của người có năng lực tài chính techcombank đáng yêu vậy
concert atvncg 2024,,atvncg,concert anh trai vượt ngàn chông gai 2024
lần nào đi concert t cũng làm rơi khăn đhs day 1 rơi khăn phong lan của a sơn day 2 rơi khăn cá lớn ckp với sao sáng tc mọe lỡ mà đi day 3 là phải chuẩn bị 3 cái khăn để rơi à,mọe, ckp tc t a,lần nào đi concert tao cũng làm rơi khăn đéo hiểu sao day 1 rơi khăn phong lan của anh sơn day 2 rơi khăn cá lớn chiếc khăn piêu với sao sáng tc nếu lỡ mà đi day 3 là phải chuẩn bị 3 cái khăn để rơi à
vãi mng chưa ăn bánh cốm àk ăn đi mng ơi để bữa nữa hết hạn bi zờ,bi zờ vãi,mng,vãi mọi người chưa ăn bánh cốm à ăn đi mọi người ơi để bữa nữa hết hạn bây giờ
có gì khó đâu chứ,,,có gì khó đâu chứ
hình gốc đây đúng 0 chú guộc,guộc,0,hình gốc đây đúng không chú ruột
hoàng hôn nắng vàng nhưng không vắng chàng,,,hoàng hôn nắng vàng nhưng không vắng chàng
kết quả câu này ra 0 đúng k,,k,kết quả câu này ra 0 đúng không
ủa ê rồi icon là cái gì nữa là sao nữa người ta đồn chăn rau có sai đâu,chăn rau,,ủa ê rồi biểu tượng là cái gì nữa là sao nữa người ta đồn săn trai có sai đâu
chắc hai ảnh sắp nhuộm tóc cho tết á chứ hong phải chăn rau đâu,chăn rau,,chắc hai ảnh sắp nhuộm tóc cho tết á chứ hong phải săn trai đâu
bác nông dân đang chăn rau cho mùa vụ sắp tới,,,bác nông dân đang chăn rau cho mùa vụ sắp tới
chú để cháu mảng này cháu lo được,,,chú để cháu mảng này cháu lo được
sao chú lại chọn icon mặt nâu cho a dương,,a,sao chú lại chọn icon mặt nâu cho anh dương
em bé có làn da nâu nâu khoẻ nâu đẹp,,,em bé có làn da nâu nâu khoẻ nâu đẹp
dỗiiiii,,,dỗiiiii
hai đứa yêu nhau chụm 2 mái đầu,,,hai đứa yêu nhau chụm 2 mái đầu
2 sếp ơi mini live đi ạ nhớ quá ạ,,,2 sếp ơi mini live đi ạ nhớ quá ạ
cute đin lun á bồ oiiii,bồ,đin lun,dễ thương điên luôn á bạn ơi
bồ t xinh lắm xinh hơn hẳn con bồ cũ,,t,bồ tao xinh lắm xinh hơn hẳn con bồ cũ
chú t có một trang trại nuôi chim bồ câu,,t,chú tao có một trang trại nuôi chim bồ câu
đến cái bóng cũng size gap tôi yêu,size gap,,đến cái bóng cũng khoảng cách về độ lớn tôi yêu
hình đẹp quá rất bóng bẩy,,,hình đẹp quá rất bóng bẩy
cooi cmt mà ê ê ê ê,,cmt,coi bình luận mà ê ê ê ê
ảnh thì tình còn cap thì chạm,,,ảnh thì tình còn tiêu đề thì chạm
iêuu nhỷ,iêuu nhỷ,,yêu nhỉ
đả hen đả hen,đả hen,,đã quá đã quá
hồng hài nhi này ngon cọng tươi,hồng hài nhi cọng tươi,,thằng bé này nhìn ngon nhìn cuốn hút
đến cái bóng cũng đẹp trai ý,,,đến cái bóng cũng đẹp trai ý
icon này ý là em luôn trẻ đẹp trong mắt anh ạ,,,icon này ý là em luôn trẻ đẹp trong mắt anh ạ
bất ngờ wá,,wá,bất ngờ quá
bảo sao lần nào gặp anh ta cũm thấy thơm phứk,,,bảo sao lần nào gặp anh ta cũm thấy thơm phức
"trong anh là một ngàn là một ngàn nhân cách nãy vừa hú hét anh đẹp trai sang xịn kia thì lên tt thấy ông chú vụng cutiii 
  ",,tt,"trong anh là một ngàn là một ngàn nhân cách nãy vừa hú hét anh đẹp trai sang xịn kia thì lên truyền thông thấy ông chú vụng đáng yêu
  "
ê nha quá là đẹp ấy ai đóng truyện vào đi để hoàng tử đi lạc như này à,,,ê nha quá là đẹp ấy ai đóng truyện vào đi để hoàng tử đi lạc như này à
tóc vuốt cỡ này thì sao mà thở nổii đâyyyy,,,tóc vuốt cỡ này thì sao mà thở nổii đâyyyy
trung bình nhân cách của những đứa mở mồm say gex,,,trung bình nhân cách của những đứa mở mồm sẽ gay
làm anti atsh chắc mệt lắm đi đâu cũng phải nghe cái list 30 bài hit của atsh,,atsh,làm anti anh trai say hi chắc mệt lắm đi đâu cũng phải nghe cái danh sách 30 bài hit của anh trai say hi
tổng hơn 50 bài á bà tính cả solo,,,tổng hơn 50 bài á bà tính cả solo
full có 4 tiếng trên ytb chắc nghe cả ngày mới hết,,ytb,full có 4 tiếng trên youtube chắc nghe cả ngày mới hết
list nhạc tết dọn nhà,,list,danh sách nhạc tết dọn nhà
t nghĩ t hiểu lý do vì sao bọn xì trây an pha meo ghét s2 hơn cg cơ bản là mặc cảm tự ti vì bên s2 nhiều thanh niên trẻ trung được nhiều fan nữ theo đuổi và hâm mộ nên trong tâm chúng nó vô tình xem dàn cast s2 là đối địch và sinh ra lòng đồ kỵ còn bên cg có nhiều các chú các bác cũng ít fan nữ nào nhận là ny là chồng nên không mang tính đe dọa đến vị trí của tụi nó,xì trây an pha meo,cg s2 t,tao nghĩ tao hiểu lý do vì sao bọn trai thẳng đàn ông quyền lực ghét say hi hơn chông gai cơ bản là mặc cảm tự ti vì bên say hi nhiều thanh niên trẻ trung được nhiều fan nữ theo đuổi và hâm mộ nên trong tâm chúng nó vô tình xem dàn cast say hi là đối địch và sinh ra lòng đồ kỵ còn bên chông gai có nhiều các chú các bác cũng ít fan nữ nào nhận là người yêu là chồng nên không mang tính đe dọa đến vị trí của tụi nó
