Text ,Slang,Abbreviations,Text meaning
đóe hiểu sao concert chuyển bài mượt như sunsilk,mượt như sunsilk đóe,,không hiểu sao concert chuyển bài mượt thế
sau mẹ yêu con là áo mùa đông luôn mẹ nuôi con lớn và lớn lên con đi ra trận,,,sau mẹ yêu con là áo mùa đông luôn mẹ nuôi con lớn và lớn lên con đi ra trận
sau ckgmdt x gene có thêm 1 đoạn nối để vào khách mời trúc nhân luôn,,ckgmdt,sau có không giữ mất đừng tìm và gene có thêm 1 đoạn nối để vào khách mời trúc nhân luôn 
gu t là mấy anh ngưu ma vương chứ mấy em hồng hài nhi nhìn thì cũng dưỡng thế dịu kha nhưng về lâu cũng chán ngưu ma vương là chân ái vừa kinh tế tinh tế lại còn tử tế,hồng hài nhi ngưu ma vương dưỡng thê dịu kha,,gu tao là mấy anh lớn tuổi chứ mấy em bé tuổi nhìn thì cũng dễ thương đáng yêu nhưng về lâu về dài cũng chán anh lớn tuổi là chân ái vừa kinh tế tinh tế lại còn tử tế
còn chưa kể cảnh kết thúc của thu hoài là gió mưa bão bùng chuyển từ tiếng mưa sang tiếng rơm rạ thóc rơi của mẹ yêu con luôn thần,thần,,còn chưa kể cảnh kết thúc của thu hoài là gió mưa bão bùng chuyển từ tiếng mưa sang tiếng rơm rạ thóc rơi của mẹ yêu con luôn đỉnh
nhờ thần mưa độ dân làng thoát khỏi cảnh hạn hán,,,nhờ thần mưa độ dân làng thoát khỏi cảnh hạn hán
nhờ ông thần mưa giúp dân làng không còn khổ vì hạn nữa,,,nhờ ông thần mưa giúp dân làng không còn khổ vì hạn nữa
ý kiến cá nhân của t là chuyển bài mượt thật nhưng mà hôm nay bên gai làm thế nhiều quá nên thời gian nghỉ giữa các bài chỉ có 34 lần mà mỗi lần đc có 1 phút t ở standing muốn ngồi xuống nghỉ ngơi cũng khó,gai,,ý kiến cá nhân của tôi là chuyển bài mượt thật nhưng mà hôm nay bên chương trình anh trai vượt ngàn chông gai làm thế nhiều quá nên thời gian nghỉ giữa các bài chỉ có 34 lần mà mỗi lần được có 1 phút tôi ở standing muốn ngồi nghỉ ngơi cũng khó
chuẩn lun,,,chuẩn luôn
ối ai đồ duy luân đã giúp em trải nghiệm khu xvip online qua thread city,ai đồ,,ối thần tượng duy luân đã giúp em trải nghiệm khu xvip online qua thread city
hết ckgmđt x gene xong tui quay ra bảo chị bên cạnh em tưởng bài này có trúc nhân ra hát cùng mng cơ vừa dứt mồm phát cái chữ trúc nhân to đùng trên màn led xong tui hoá thú cmnl mà,cmnl con mẹ nó luôn,,hết có không giữ mất đừng tìm và gene xong tui quay ra bảo chị bên cạnh em tưởng bài này có trúc nhân ra hát cùng mọi người cơ vừa dứt mồm phát cái chữ trúc nhân to đùng trên màn led xong tui hoá thú luôn mà
trời ơi ngay sau đó bài không ra gì được mix lại cho cháy hơn tôi cũng thét váng tai luôn ôi mẹ ơi nó cháy điênnnnn,cháy điên,,trời ơi ngay sau đó bài không ra gì được mix lại cho náo nhiệt tôi cũng thét váng tai luôn ôi mẹ ơi nó cháy cực
hic cái đoạn sau quá là trôi nối vào thông điệp sống phải có niềm tin sau đó là niềm tin chiến thắng zone t đứng chị em khóc tu tu,,,hic cái đoạn sau quá là trôi nối vào thông điệp sống phải có niềm tin sau đó là niềm tin chiến thắng zone tôi đứng chị em khóc tu tu
xong mn shoutout cho đội tuyển hôm nay thi đấu người hát còn là chú hồng sơn má ơi nó tự hào kinh khủng khiếppp,,,xong mọi người shoutout cho đội tuyển hôm nay thi đấu người hát còn là chú hồng sơn má ơi nó tự hào kinh khủng khiếppp
trúc nhàn không ra gì xong lại còn đệm thêm 1 đoạn guitar điện kiếp ve sầu xong anh bo bay ra trời ơi đaiwbsiwbsjsbwisgaksnsjdoajabsj,,,trúc nhàn không ra gì xong lại còn đệm thêm 1 đoạn guitar điện kiếp ve sầu xong anh bo bay ra trời ơi 
khoảnh khắc anh bo trượt zipline bay xuống tôi đã đứng họng luôn ko có ngôn từ nào diễn tả nổi nữa tt,,ko,khoảnh khắc anh bo trượt zipline bay xuống tôi đã đứng họng luôn không có ngôn từ nào diễn tả nổi nữa 
có mấy bài phối lại í đỉnh,,,có mấy bài phối lại í đỉnh
hồi d1 cái đoạn chuyển cảnh từ thu hoài kết bài 5 nấm mồ hiện lên xong đó cũng là background của dchl nó buồn mà nó match nhau kinh khủng t phải đem khoe cái đoạn ấy với 7749 người rồi ấy vậy mà d2 chú thư lại làm mọi thứ còn mượt hơn nữa storytelling đỉnh phát khóc,,dchl,hồi d1 cái đoạn chuyển cảnh từ thu hoài kết bài 5 nấm mồ hiện lên xong đó cũng là background của dẫu có lỗi lầm nó buồn mà nó match nhau kinh khủng tao phải đem khoe cái đoạn ấy với 7749 người rồi ấy vậy mà d2 chú thư lại làm mọi thứ còn mượt hơn nữa storytelling đỉnh phát khóc
uh chuyển cảnh rồi kịch bản đỉnh cao thật sự nó mượt thôi rồi ấy,,,ừ chuyển cảnh rồi kịch bản đỉnh cao thật sự nó mượt thôi rồi ấy
cả sau bao tiền một mớ bình yên tung 1 đống giấy là chuyển qua tỉnh thức sau giấc ngủ đông có chú hồng sơn cầm chổi quét giấy lun,,,cả sau bao tiền một mớ bình yên tung 1 đống giấy là chuyển qua tỉnh thức sau giấc ngủ đông có chú hồng sơn cầm chổi quét giấy luôn
mọi người đi concert nhặt pháo giấy bé xinh cute về làm kỷ niệm,,,mọi người đi concert nhặt pháo giấy bé xinh cute về làm kỷ niệm
tôi thó được cả pháo giấy trống cơm cỡ 5 6m quấn được chục vòng quanh cổ mang về,thó,,tôi lấy được cả pháo giấy trống cơm cỡ 5 6m quấn được chục vòng quanh cổ mang về
đ hiểu sao họ mang được anh tuấn lên kéo cello và sau đó và dẫu có lỗi lầm,đ,,không hiểu sao họ mang được anh tuấn lên kéo cello và sau đó và dẫu có lỗi lầm
họ chỉn chu họ chuyên nghiệp họ tâm huyết họ yêu thương fan họ mở concert chỉ để lãi tcảm họ là atvncg,,atvncg,họ chỉn chu họ chuyên nghiệp họ tâm huyết họ yêu thương fan họ mở concert chỉ để lãi tình cảm họ là anh trai vượt ngàn chông gai
concert atvncg2024,,atvncg,concert anh trai vượt ngàn chông gai
lúc hết chú tuấn gọi tất cả ekip lên chụp ảnh bảo fan hô tên chú thư chú vịnh chị hạnh chú long kenji,,,lúc hết chú tuấn gọi tất cả ekip lên chụp ảnh bảo fan hô tên chú thư chú vịnh chị hạnh chú long kenji
btc tặng mỗi fan kẹo nước miếng giữ nhiệt,,btc,ban tổ chức tặng mỗi fan kẹo nước miếng giữ nhiệt
cả fan btc các anh tài hở ra lại cảm ơn vì đã đến,,btc,cả fan ban tổ chức các anh tài hở ra lại cảm ơn vì đã đến
delay 30p vì fan vẫn còn đang xếp hàng checkin họ nhất định chờ tất cả gai con mới bđầu,gai con,,delay 30 phút vì fan vẫn còn đang xếp hàng checkin họ nhất định chờ tất cả gai con mới bắt đầu
staff chào gai con nhé từ cổng vào đến cổng về còn chúc ngủ ngon,gai con,,staff chào gai con nhé từ cổng vào đến cổng về còn chúc ngủ ngon
họ cho chúng tôi trải nghiệm tuyết rơi ngay tại hưng yên,,,họ cho chúng tôi trải nghiệm tuyết rơi ngay tại hưng yên
anh tài thứ 34 là mc anh tuấn và anh tài thứ 35 là kim chủ techcombank vì ctui cổ vũ họ nhiệt tình không khác gì các anh tài,kim chủ,mc,anh tài thứ 34 là người dẫn chương trình anh tuấn và anh tài thứ 35 là nhà tài trợ techcombank vì chúng tôi cổ vũ họ nhiệt tình không khác gì các anh tài
delay 30p mà nt1 chỗ tôi k một ai phàn nàn mng cứ chill tâm tình hỏi han ai từ đâu đến rồi mng tự ngồi ôn bài vui lắm khúc đọc lời nhắn của chủ choẹ tôi đã quay ra ôm người chị từ hcm một cái ôm ấm âp vô cùng,chủ chọe,hcm,delay 30 phút mà nhà trẻ 1 chỗ tôi không một ai phàn nàn mọi người cứ chill tâm tình hỏi han ai từ đâu đến rồi mọi người tự ngồi ôn bài vui lắm khúc đọc lời nhắn của chương trình tôi đã quay ra ôm người chị từ hồ chí minh một cái ôm ấm âp vô cùng
tui thấy mng nỗ lực kinh khủng nên loa mic có lỗi thì tui thấy thông cảm dã man có mấy bạn chê là z là thiếu tôn trọng mấy anh huhu tội ekip vch lỗi thì lỗi chứ nói z nặng lắm luôn bạn nonfan nào cứ lên kêu mình hát toàn bộ có backtrack nữa tr ơi hát live hay quá xong bị bác bỏ bằng việc bật backtrack hả,,,tui thấy mọi người nỗ lực kinh khủng nên loa mic có lỗi thì tui thấy thông cảm dã man có mấy bạn chê là vậy là thiếu tôn trọng mấy anh huhu tội ekip vãi chưởng lỗi thì lỗi chứ nói vậy nặng lắm luôn bạn nonfan nào cứ lên kêu mình hát toàn bộ có backtrack nữa trời ơi hát live hay quá xong bị bác bỏ bằng việc bật backtrack hả
có ai dựng booth ekip không nhỉ,,,có ai dựng booth ekip không nhỉ
đm mà đoạn chú tự long bảo bao nhiêu vé ko quan trọng tôi cười to vl,dm vl,,trời ơi mà đoạn chú tự long bảo bao nhiêu vé không quan trọng tôi cười to lắm
lúc chú bảo 10k người ở đây t với bạn t quay sang bảo 50k mà chú,,,lúc chú bảo 10 nghìn người ở đây tao với bạn tao quay sang bảo 50 nghìn mà chú
chú mở bài gián tiếp,,,chú mở bài gián tiếp
số cũng chỉ để đếm thôi,,,số cũng chỉ để đếm thôi
phát ngôn đỉnh nóc,đỉnh nóc,,phát ngôn đỉnh quá
đúng vậy bao nhiêu vé không quan trọng sold out hay không không quan trọng 10k 50k 78k hay 100k cũng không quan trọng,,,đúng vậy bao nhiêu vé không quan trọng sold out hay không không quan trọng 10 nghìn 50 nghìn 78 nghìn hay 100 nghìn cũng không quan trọng
số cũng chỉ để đếm best khịa,khịa,,số cũng chỉ để đếm best trêu chọc
bên tụi t cũng cười rồ t v bạn gai con đứng bên cạnh còn bảo nhau đúng là quân triều đình cỡ nào cũng nói đc,quân triều đình,,bên tụi tôi cũng cười rồ tôi và bạn yêu thích chương trình anh trai vượt ngàn chông gai đứng bên cạnh còn bảo nhau đúng là người có sức ảnh hưởng ở các cơ quan quốc gia cỡ nào cũng nói được
đỉnk,,,đỉnh
số chỉ để đếm thôi đi coi có nhiều khoảnh khắc hay thiệc,,,số chỉ để đếm thôi đi coi có nhiều khoảnh khắc hay thiệc
khu tui còn có b bảo chú cảm ơn có 10k thì ai đc cảm ơn ai k,,,khu tui còn có bạn bảo chú cảm ơn có 10 nghìn thì ai được cảm ơn ai không
chỗ tôi cũng cười vl cười nghe nó thấm thsu,vl,,chỗ tôi cũng cười lấy cười để nghe nó thấm thật sự
nguyên cái khu t ngồi cười rần rần,,,nguyên cái khu tôi ngồi cười rần rần
chú nói đúng mà tầm này t đâu quan tâm bao nhiêu vé t chỉ quan tâm t có vé ko thôi,,,chú nói đúng mà tầm này ta đâu quan tâm bao nhiêu vé ta chỉ quan tâm ta có vé ko thôi
chú nói đúng quá chòi người muốn biết sẽ hiểu với chúng ta bây giờ điều quan trọng là có vé hay k thôi,quá chòi,,chú nói đúng quá luôn người muốn biết sẽ hiểu với chúng ta bây giờ điều quan trọng là có vé hay không thôi
chú thoát pressing rất chuyên nghiệp,thoát pressing,,chú xử lý tình huống dễ dàng rất chuyên nghiệp
thật sự xin lỗi vì đã cười hơi to,,,thật sự xin lỗi vì đã cười hơi to
đúng là a long trong truyền thuyết chả ngán gì ai,,,đúng là anh long trong truyền thuyết chả ngán gì ai
con số cũng chỉ để đếm,,,con số cũng chỉ để đếm
bao nhiêu cũng chỉ là số đếm,,,bao nhiêu cũng chỉ là số đếm
chú thâm kkkk,,,chú thâm hahaha
tôi đã hét lên up lên threads cho tao,,,tôi đã hét lên up lên threads cho tao
cả hàng ghế tui cười ngả nghiêng,,,cả hàng ghế tui cười ngả nghiêng
bên tôi cũng cười khà khà,,,bên tôi cũng cười khà khà
eq dương vô cùng cmnl,cmnl,eq cmnl,trí tuệ cảm xúc dương vô cùng luôn
con số đối với tôi cũng chỉ là để đếm thôiiii,,,con số đối với tôi cũng chỉ là để đếm thôi
con số cũng chỉ để đếm thôi bọn t cười vcl,vcl,,con số cũng chỉ để đếm thôi bọn tôi cười lớn
công tâm mà nói thì khâu tổ chức hôm qua nó cũng như bao chiếc show vn t từng đi thôi nhưng trộm vía cũng ko bị gặp chuyện gì khó chịu nhưng cái đỉnh nhất t nghĩ đéo show nào làm đc là tụ đc hội người trẩu tre chúng tôi đứng hát nhạc dân tộc kiểu mọi người đồng thanh hát chèo í ê luôn,trẩu tre đéo,vn,công tâm mà nói thì khâu tổ chức hôm qua nó cũng như bao chiếc show việt nam tôi từng đi thôi nhưng trộm vía cũng không bị gặp chuyện gì khó chịu nhưng cái đỉnh nhất t nghĩ đâu show nào làm được là tụ được hội người trẻ tuổi chúng tôi đứng hát nhạc dân tộc kiểu mọi người đồng thanh hát chèo í ê luôn
với cả xây quả sân khấu điên vl,điên vl quả sân khấu,vl,với cả xây khu vực sân khấu đỉnh quá
btw cái đoạn rap t thích nhất trong cả cái show này là câu nhưng mà để giới trẻ nghe được nhạc trịnh thì đối với anh là thế mới ngầu của hà lê xong show này kiểu,,,btw cái đoạn rap tôi thích nhất trong cả cái show này là câu nhưng mà để giới trẻ nghe được nhạc trịnh thì đối với anh là thế mới ngầu của hà lê xong show này kiểu
và t vẫn k thể thẩm đc cái lightstick xốp của tcb xấu ỉa,,,và tao vẫn không thể thẩm được cái lightstick xốp của techcombank xấu ỉa
sân khấu đỉnh quá đọc post anh rhym xong mới nhớ hqua lỗi mic bé vl chỗ t có mấy đoạn nhạc to hơn tiếng hát xong lỗi inear mấy đoạn í rap vs hát lệch cmn nhạc,vl cmn,vl,sân khấu đỉnh quá đọc post anh rhym xong mới nhớ hôm qua lỗi mic bé quá chỗ tui có mấy đoạn nhạc to hơn tiếng hát xong lỗi inear mấy đoạn í rap và hát lệch luôn nhạc
đm đa đa hqua đẹp trai vl xin lỗi ai nonfan đứng cạnh tôi vì tôi hét quá nhiều,dm vl,vl,ôi trời đa đa hôm qua đẹp trai quá xin lỗi ai nonfan đứng cạnh tôi vì tôi hét quá nhiều
cái chỗ t cảm giác cũng hơi trầm so với t hic cái đoạn trả bài 9m cảm giác cũng có mấy mống xung quanh chỗ t í nói xong cũng thấy ngài ngại lành lạnh trách t vào sát giờ nên cũng đứng cuối cuối,mống,,cái chỗ tao cảm giác cũng hơi trầm so với tao hic cái đoạn trả bài chín muồi cảm giác cũng có mấy bạn xung quanh chỗ tao í nói xong cũng thấy ngài ngại lành lạnh trách tao vào sát giờ nên cũng đứng cuối cuối
day1 nó hơn hẳn các concert mk từng xem ở vn ý nhưng day2 nó hơi xu ai mà trải nghiệm day1 r là xem day2 sẽ có chút thất vọng,"
xu",vn,day1 nó hơn hẳn các concert mình từng xem ở việt nam ý nhưng day2 nó hơi tệ ai mà trải nghiệm day1 rồi là xem day2 sẽ có chút thất vọng
tôi hqua đứng ở booth của cường seven bảo an dẫn binz đi xuyên qua booth thế là xô bọn t ra kết quả tôi bị xô ngã sml xong hỏng booth của các bạn bên cường seven luôn vừa đau vừa cay,sml,,tôi hôm qua đứng ở booth của cường seven bảo an dẫn binz đi xuyên qua booth thế là xô bọn tôi ra kết quả tôi bị xô ngã mạnh xong hỏng booth của các bạn bên cường seven luôn vừa đau vừa cay
hôm qua chỗ booth hỗn loạn luôn ấy t kb trong sg ntn mà cái chỗ hqua đấy nó chật điên lúc bthg ko sao mà lúc mấy anh ra là chật vl muốn đi tiếp cũng ko có chỗ mà đi cơ nên t k hiểu lắm những ng k định đi booth thì có đường khác vào thẳng sân k,điên vl,sg vl,hôm qua chỗ booth hỗn loạn luôn ấy tôi không biết trong sài gòn như thế nào mà cái chỗ hôm qua đấy nó chật kinh khủng lúc bình thường không sao mà lúc mấy anh ra là chật lắm muốn đi tiếp cũng không có chỗ mà đi cơ nên tôi không hiểu lắm những người không định đi booth thì có đường khác vào thẳng sân không
trải nghiệm quá tệ hại với staff chương trình,,,trải nghiệm quá tệ hại với staff chương trình
core staff thì dễ thương bạn ơi nhưng các đội thuê thêm thì khó kiểm soát đợt trong sg là phải thuê hẳn team bảo an của chú tùng yuki ấy,,sg,core staff thì dễ thương bạn ơi nhưng các đội thuê thêm thì khó kiểm soát đợt trong sài gòn là phải thuê hẳn team bảo an của chú tùng yuki ấy
t k cần biết thuê thêm hay ntn xếp hàng dài mấy cây số không 1 bóng staff điều phối vào line soát vé thì staff bảo vào hết đi không cần theo zone không ai take care chỉ đường vào zone mà 4r 5h kém tắc cứng đường khu khác lạc sang là vì thế luôn ấy không hề kiểm vé zone 12 rồi không đóng zone cho khán giả ra đứng đầy ngoài lối đi giữa zone ngồi với đứng nói thì kêu đi standing phải chấp nhận cổ động việt làm ăn cực kì bát nháo tệ hại,,,tôi không cần biết thuê thêm hay như thế nào xếp hàng dài mấy cây số không 1 bóng staff điều phối vào line soát vé thì staff bảo vào hết đi không cần theo zone không ai take care chỉ đường vào zone mà 4 rưỡi 5 giờ kém tắc cứng đường khu khác lạc sang là vì thế luôn ấy không hề kiểm vé zone 12 rồi không đóng zone cho khán giả ra đứng đầy ngoài lối đi giữa zone ngồi với đứng nói thì kêu đi standing phải chấp nhận cổ động việt làm ăn cực kì bát nháo tệ hại
mình là gai con chả đi đc concert nghe mấy dòng này muốn xin lỗi bạn quá xin lỗi bạn vì những trải nghiệm tệ này ạ,gai con,,mình là người ủng hộ chương trình anh trai vượt ngàn chông gai chả đi được concert nghe mấy dòng này muốn xin lỗi bạn quá xin lỗi bạn vì những trải nghiệm tệ này ạ
k bạn lquan gì đâu mà xin lỗi ạ hqua rất vui trừ staff focus cam và âm thanh lỗi và 1 số người vô ý thức vl ra thì t vẫn rất enjoy các tiết mục dù zone t chán vl mn k quẩy nhưng t vẫn quẩy tới cuối đứt cmn cuống họng,quẩy vl cmn,vl,không bạn liên quan gì đâu mà xin lỗi ạ hôm qua rất vui trừ staff focus cam và âm thanh lỗi và 1 số người vô ý thức lắm ra thì tui vẫn rất enjoy các tiết mục dù zone tui chán lắm mọi người không nhảy nhưng tui vẫn nhảy tới cuối đứt luôn cuống họng
quẩy mà ăn với phở thì đúng là hết nước chấm,hết nước chấm,,quẩy mà ăn với phở thì đúng là ngon
cô bán ốc bảo tôi nếu hết nước chấm thì gọi cô để cô mang thêm cho,,,cô bán ốc bảo tôi nếu hết nước chấm thì gọi cô để cô mang thêm cho
về trải nghiệm ngoài lề thì day 1 có vẻ tốt hơn ít feedback chê hơn day 2 thì không lẽ do đông quá mà không kiểm soát dc bù lại thì cũng rất ghen tị vì huhuhu các tiết mục của day 2 xịn quá,,,về trải nghiệm ngoài lề thì day 1 có vẻ tốt hơn ít feedback chê hơn day 2 thì không lẽ do đông quá mà không kiểm soát dc bù lại thì cũng rất ghen tị vì huhuhu các tiết mục của day 2 xịn quá
toi là tnv nhưng tương đối không ưa bảo an ở khu toi đứng vì mấy chả cứ cợt nhả giỡn giỡn với chị leader khu vực trong lúc đang làm việc nghiêm túc kiểu rất hỏi chấm kì quặc luôn ý,hỏi chấm,tnv,toi là tình nguyện viên nhưng tương đối không ưa bảo an ở khu toi đứng vì mấy chả cứ cợt nhả giỡn giỡn với chị leader khu vực trong lúc đang làm việc nghiêm túc kiểu rất thấy lạ kì quặc luôn ý
cái chê nhất hôm qua là lúc đi về tui ngồi kaka phải đi cổng sau tắc lòi vì lối đó trùng lối đỗ xe ô tô,lòi,,cái chê nhất hôm qua là lúc đi về tui ngồi kaka phải đi cổng sau tắc kinh vì lối đó trùng lối đỗ xe ô tô
nhạc chèo nhưng anh chị em quẩy nhiệt tình vẫy lighstick nhiệt tình như nhạc edm vậy,quẩy,,nhạc chèo nhưng anh chị em nhảy nhiệt tình vẫy lighstick nhiệt tình như nhạc edm vậy
toi ngồi cạnh 3ac dc tặng vé nên đi các ac k phải fan ac nghe quăng miếng inside joke tên bài tên nhà k hiểu gì tí tí lại quay sang hỏi nhưng các ac enjoy cực kì và cứ bật cười liên tục vì con bé bên cạnh là tôi hết ca cải lương r lại hú vina house dễ huông lắmmm,quăng miếng dễ huông,,toi ngồi cạnh 3 anh chị được tặng vé nên đi các anh chị không phải fan anh chị nghe kể chuyện inside joke tên bài tên nhà không hiểu gì tí tí lại quay sang hỏi nhưng các anh chị enjoy cực kì và cứ bật cười liên tục vì con bé bên cạnh là tôi hết ca cải lương rồi lại hú vina house dễ thương lắmmm
mọi người hát chèo với dạ cổ hoài lang cực ckat í,,,mọi người hát chèo với dạ cổ hoài lang cực chất í
tự hỏi atvncg không có tệp fan như bây giờ tệp fan chịu chi chịu đi gieo hạt chịu đứng ra bảo vệ thì không biết chương trình nó đi về đâu nữa,gieo hạt,atvncg,tự hỏi anh trai vượt ngàn chông gai không có tệp fan như bây giờ tệp fan chịu chi chịu đi lan tỏa chịu đứng ra bảo vệ thì không biết chương trình nó đi về đâu nữa
bác nông dân đang gieo hạt cây đu đủ để sang năm mang ra chợ đi bán,,,bác nông dân đang gieo hạt cây đu đủ để sang năm mang ra chợ đi bán
thật nhiều lúc tự hỏi y1 có bao giờ thật sự làm truyền thông cho cg chưa cảm thấy iu mấy nhỏ đối tác gieo hạt lắm lắm luôn,gieo hạt,cg iu,thật nhiều lúc tự hỏi y1 có bao giờ thật sự làm truyền thông cho chông gai chưa cảm thấy yêu mấy nhỏ đối tác lan tỏa lắm lắm luôn
ekip đi lên từ thực lực xứng danh luôn chứ bị dàn cast spoil còn vô cmt lau nước mắt thì làm gì nổi cái truyền thông mạnh mà chưa kể conme gai comcert hn đã mạnh dạn không thèm chạy ads như day1 luôn là đã quá khen với mẻ rồi chứ đừng mong ekip nổi gió lên,,hn,ekip đi lên từ thực lực xứng danh luôn chứ bị dàn cast spoil còn vô cmt lau nước mắt thì làm gì nổi cái truyền thông mạnh mà chưa kể conme gai comcert hà nội đã mạnh dạn không thèm chạy ads như day1 luôn là đã quá khen với mẻ rồi chứ đừng mong ekip nổi gió lên
mỗi lúc săn vé chỉ mong chương trình flop chứ săn fmt không trúng cái nào cc tgif càng đừng nói,,,mỗi lúc săn vé chỉ mong chương trình flop chứ săn fmt không trúng cái nào cc tgif càng đừng nói
nhma vẫn đ hiểu bằng 1 thế lực nào đó mà ekip rải rác toàn cõi mxh để canh chừng gai con lẫn anh tài không có việc này thì cũng còn việc khác đi canh me gai con lên bài hít ke tâm sự tuổi hồng con hỏi mẹ tl ê t thấy cũm không có nhàn mấy hâhhaa,gai con hít ke tâm sự tuổi hồng đ cũm,,nhma vẫn không hiểu bằng 1 thế lực nào đó mà ekip rải rác toàn cõi mạng xã hội để canh chừng người ủng hộ chương trình anh trai vượt ngàn chông gai lẫn anh tài không có việc này thì cũng còn việc khác đi canh me chương trình anh trai vượt ngàn chông gai lên bài chia sẻ về quá khứ con hỏi mẹ trả lời ê tôi thấy cũng không có nhàn mấy hâhhaa
sơ sểnh gặp chính quyền mà conmegai biết quá nhiều nhe,chính quyền conmegai,,sơ sểnh gặp người có thẩm quyền cao mà ban tổ chức chương trình anh trai vượt ngàn chông gai biết quá nhiều nhe
